pncp_id,objeto_compra,objeto_limpo,relevante_pred
13937032000160-1-000397/2026,"Contratação de Serviços de Atualização, Garantia e Suporte Técnico para o Software Veritas Netbackup",contratação serviços atualização garantia suporte técnico software veritas netbackup,1
00038166000105-1-000127/2026,"Aquisição de ADCs (Application Delivery Controllers), licenças, garantia e consultoria do fabricante F5, treinamentos e suporte",aquisição adcs application delivery controllers licenças garantia consultoria fabricante treinamentos suporte,1
29138369000147-1-000062/2026,"A aquisição de servidor rack de alto desempenho e alta capacidade de armazenamento tem como objetivo atender às necessidades operacionais da Secretaria Municipal de Ciência e Tecnologia de Teresópolis.
",aquisição servidor rack alto desempenho alta capacidade armazenamento objetivo atender necessidades operacionais secretaria municipal ciência tecnologia teresópolis,1
18116145000118-1-000037/2026,"AQUISIÇÃO DE TELAS INTERATIVAS PARA ATENDER AS UNIDADES ESCOLARES DA SECRETARIA MUNICIPAL DE EDUCAÇÃO DE FORTUNA DE MINAS, MEDIANTE ADESÃO À ATA DE REGISTRO DE PREÇOS Nº 007/2025 DO CONSÓRCIO INTERMUNICIPAL MULTIFINALITÁRIO DE MINAS GERAIS (COMGRAMBEL)",aquisição telas interativas atender unidades escolares secretaria municipal educação fortuna minas mediante adesão ata registro preços consórcio intermunicipal multifinalitário minas gerais comgrambel,1
